17:40:21.062781 IP 192.168.122.1.60367 > 192.168.122.239.9801: Flags [S], seq 3691818470, win 29200, options [mss 1460,sackOK,TS val 413336609 ecr 0,nop,wscale 7], length 0
17:40:21.062809 IP 192.168.122.239.9801 > 192.168.122.1.60367: Flags [S.], seq 300954309, ack 3691818471, win 28960, options [mss 1460,sackOK,TS val 4185020624 ecr 413336609,nop,wscale 7], length 0
17:40:21.062895 IP 192.168.122.1.60367 > 192.168.122.239.9801: Flags [.], ack 300954310, win 229, options [nop,nop,TS val 413336609 ecr 4185020624], length 0
17:40:21.062924 IP 192.168.122.1.60367 > 192.168.122.239.9801: Flags [P.], seq 3691818471:3691818495, ack 300954310, win 229, options [nop,nop,TS val 413336609 ecr 4185020624], length 24
17:40:21.062934 IP 192.168.122.239.9801 > 192.168.122.1.60367: Flags [.], ack 3691818495, win 227, options [nop,nop,TS val 4185020624 ecr 413336609], length 0
17:40:21.062990 IP 192.168.122.1.60368 > 192.168.122.239.9801: Flags [S], seq 454442822, win 29200, options [mss 1460,sackOK,TS val 413336609 ecr 0,nop,wscale 7], length 0
17:40:21.063001 IP 192.168.122.239.9801 > 192.168.122.1.60368: Flags [S.], seq 806152298, ack 454442823, win 28960, options [mss 1460,sackOK,TS val 4185020624 ecr 413336609,nop,wscale 7], length 0
17:40:21.063033 IP 192.168.122.1.60368 > 192.168.122.239.9801: Flags [.], ack 806152299, win 229, options [nop,nop,TS val 413336609 ecr 4185020624], length 0
17:40:21.063072 IP 192.168.122.1.60368 > 192.168.122.239.9801: Flags [P.], seq 454442823:454442847, ack 806152299, win 229, options [nop,nop,TS val 413336609 ecr 4185020624], length 24
17:40:21.063078 IP 192.168.122.239.9801 > 192.168.122.1.60368: Flags [.], ack 454442847, win 227, options [nop,nop,TS val 4185020624 ecr 413336609], length 0
17:40:21.063088 IP 192.168.122.1.60368 > 192.168.122.239.9801: Flags [.], seq 454442847:454455879, ack 806152299, win 229, options [nop,nop,TS val 413336609 ecr 4185020624], length 13032
17:40:21.063093 IP 192.168.122.239.9801 > 192.168.122.1.60368: Flags [.], ack 454455879, win 430, options [nop,nop,TS val 4185020624 ecr 413336609], length 0
